[
  { "id": "bean-240", "name": "牙买加蓝山", "origin": "牙买加·蓝山山脉", "variety": "铁皮卡变异种（蓝山）", "process": "水洗", "roast_level": "中烘", "flavor_tags": ["均衡", "细腻", "坚果", "柔和甜"], "purchase_price": 120, "usable_drinks": ["drink-pourover", "drink-espresso", "drink-latte"], "source_chapter": "遗忘·关于咖啡的成见", "source_quote": "当铁皮卡种咖啡树在牙买加的 自然环境里扎根， 为了适应当地环境， 就逐渐变异成一个新咖啡品 种， 也就是今天的蓝山咖啡。", "source_book": "咖啡全书", "confidence": "high" },
  { "id": "bean-241", "name": "非洲蓝山", "origin": "肯尼亚 / 圣多美", "variety": "铁皮卡变型体（蓝山）", "process": "未标注", "roast_level": "中浅烘", "flavor_tags": ["细腻", "明亮", "花果香"], "purchase_price": 72, "usable_drinks": ["drink-pourover"], "source_chapter": "遗忘·关于咖啡的成见", "source_quote": "这种铁皮卡种咖啡的变型体蓝山咖啡在 加勒比海的其他地方也可以找到， 尤其是圣多美和非洲的肯尼亚。", "source_book": "咖啡全书", "confidence": "high" },
  { "id": "bean-242", "name": "那不勒斯式罗布斯塔拼配", "origin": "意大利·那不勒斯风格", "variety": "罗布斯塔混合", "process": "未标注", "roast_level": "深烘", "flavor_tags": ["浓烈", "甘甜", "苦韵"], "purchase_price": 22, "usable_drinks": ["drink-espresso", "drink-latte"], "source_chapter": "遗忘·关于咖啡的成见", "source_quote": "那不勒斯咖啡是罗布斯塔种咖啡的混合物， 适合热饮， 极其浓烈 甘甜， 会在口中爆裂开来， 给人强烈的味觉冲击。", "source_book": "咖啡全书", "confidence": "high" },
  { "id": "bean-243", "name": "罗马式五五拼配", "origin": "意大利·罗马风格", "variety": "50%罗布斯塔＋50%阿拉比卡", "process": "未标注", "roast_level": "中深烘", "flavor_tags": ["厚实", "焦糖", "苦韵"], "purchase_price": 28, "usable_drinks": ["drink-espresso", "drink-latte"], "source_chapter": "遗忘·关于咖啡的成见", "source_quote": "采用的是50%罗布斯塔种加50% 阿拉比卡种的混合咖啡豆。", "source_book": "咖啡全书", "confidence": "high" },
  { "id": "bean-244", "name": "黄波旁", "origin": "美国市场流通的黄果产区", "variety": "黄色波旁种", "process": "未标注", "roast_level": "中浅烘", "flavor_tags": ["清淡", "甘甜", "优雅"], "purchase_price": 55, "usable_drinks": ["drink-pourover", "drink-latte"], "source_chapter": "遗忘·关于咖啡的成见", "source_quote": "美国人消费的咖啡品种 口味较为清淡甘甜。那些咖啡树上通常都结着黄色的果子， 比如黄色 波旁种", "source_book": "咖啡全书", "confidence": "medium" },
  { "id": "bean-245", "name": "埃塞俄比亚摩卡", "origin": "埃塞俄比亚", "variety": "阿拉比卡", "process": "日晒", "roast_level": "中浅烘", "flavor_tags": ["花香", "果味", "明亮酸"], "purchase_price": 62, "usable_drinks": ["drink-pourover"], "source_chapter": "遗忘·关于咖啡的成见", "source_quote": "您一定常常听说埃塞俄比亚的摩卡咖啡， 甚至可能还是这种咖啡 的粉丝； 或者恰恰相反， 这是您最为讨厌的咖啡： 太湿、花香太重、 太酸、果味太重。", "source_book": "咖啡全书", "confidence": "high" },
  { "id": "bean-246", "name": "也门摩卡", "origin": "也门", "variety": "阿拉比卡", "process": "日晒", "roast_level": "中烘", "flavor_tags": ["干果", "香料", "厚实"], "purchase_price": 88, "usable_drinks": ["drink-pourover", "drink-espresso"], "source_chapter": "遗忘·关于咖啡的成见", "source_quote": "摩卡可以指代产自埃塞俄比亚的阿拉比卡种咖啡， 但也可以是产自也门的。", "source_book": "咖啡全书", "confidence": "high" },
  { "id": "bean-247", "name": "哥伦比亚水洗豆", "origin": "哥伦比亚", "variety": "阿拉比卡", "process": "水洗", "roast_level": "中烘", "flavor_tags": ["干净", "坚果", "均衡"], "purchase_price": 58, "usable_drinks": ["drink-pourover", "drink-espresso", "drink-latte"], "source_chapter": "捍卫·我们的信念", "source_quote": "哥伦比亚以生产高品质咖啡而闻名， 巴西咖啡的品质中等， 洪都 拉斯最差。", "source_book": "咖啡全书", "confidence": "high" },
  { "id": "bean-248", "name": "巴西半日晒豆", "origin": "巴西", "variety": "阿拉比卡", "process": "蜜处理", "roast_level": "中深烘", "flavor_tags": ["饱满", "干净", "可可"], "purchase_price": 34, "usable_drinks": ["drink-espresso", "drink-latte"], "source_chapter": "加工·酝酿发酵", "source_quote": "残存在咖啡豆上的黏膜将在太阳下发酵晾 晒十几天， 以获得美味的咖啡——虽然香气层次有限， 但口感饱满干 净， 是调配浓缩咖啡的理想原料。", "source_book": "咖啡全书", "confidence": "high" },
  { "id": "bean-249", "name": "洪都拉斯低阶豆", "origin": "洪都拉斯", "variety": "阿拉比卡", "process": "水洗", "roast_level": "中深烘", "flavor_tags": ["平淡", "苦韵"], "purchase_price": 15, "usable_drinks": ["drink-espresso"], "source_chapter": "捍卫·我们的信念", "source_quote": "巴西咖啡 价格略低于市场价， 洪都拉斯咖啡价格则远远低于市场价——这就是 所谓的差率价格。", "source_book": "咖啡全书", "confidence": "high" },
  { "id": "bean-250", "name": "巴拿马博克特瑰夏", "origin": "巴拿马·博克特", "variety": "瑰夏", "process": "水洗", "roast_level": "浅烘", "flavor_tags": ["花香", "柑橘", "茶感"], "purchase_price": 180, "usable_drinks": ["drink-pourover"], "source_chapter": "种植·好苗苗长成咖啡树", "source_quote": "他在1973年带回了一种让他惊奇 的未经开发的埃塞俄比亚品种咖啡树的种子：瑰夏。我们知道 ，这 种咖啡的根系很小 ，所以产量很小且很柔弱。", "source_book": "咖啡全书", "confidence": "high" },
  { "id": "bean-251", "name": "宝贝瑰夏", "origin": "巴拿马", "variety": "瑰夏（两三岁幼树）", "process": "水洗", "roast_level": "浅烘", "flavor_tags": ["清爽", "细致"], "purchase_price": 140, "usable_drinks": ["drink-pourover"], "source_chapter": "种植·好苗苗长成咖啡树", "source_quote": "特别是从树龄只有两三岁的幼树上 采收而得的“宝贝”瑰夏被当作市场新宠贩卖， 其口味清爽细致， 不过 少了些层次感。", "source_book": "咖啡全书", "confidence": "high" },
  { "id": "bean-252", "name": "留尼汪尖身波旁", "origin": "法属留尼汪岛", "variety": "尖身波旁", "process": "水洗", "roast_level": "中浅烘", "flavor_tags": ["柔和", "甜感", "细致"], "purchase_price": 200, "usable_drinks": ["drink-pourover"], "source_chapter": "烘焙·焙炒咖啡豆", "source_quote": "这里采用的尖身 波旁种咖啡豆产自留尼汪岛尖身波旁合作社。", "source_book": "咖啡全书", "confidence": "high" },
  { "id": "bean-253", "name": "卢旺达红波旁", "origin": "卢旺达", "variety": "红色波旁", "process": "水洗", "roast_level": "中浅烘", "flavor_tags": ["红果", "明亮酸", "甜感"], "purchase_price": 70, "usable_drinks": ["drink-pourover", "drink-espresso"], "source_chapter": "烘焙·焙炒咖啡豆", "source_quote": "无论是危地马拉的安 提瓜还是卢旺达的红色波旁种咖啡豆均能处理得宜。", "source_book": "咖啡全书", "confidence": "high" },
  { "id": "bean-254", "name": "危地马拉安提瓜", "origin": "危地马拉·安提瓜", "variety": "阿拉比卡", "process": "水洗", "roast_level": "中烘", "flavor_tags": ["可可", "香料", "厚实"], "purchase_price": 76, "usable_drinks": ["drink-espresso", "drink-pourover", "drink-latte"], "source_chapter": "烘焙·焙炒咖啡豆", "source_quote": "无论是危地马拉的安 提瓜还是卢旺达的红色波旁种咖啡豆均能处理得宜。", "source_book": "咖啡全书", "confidence": "high" },
  { "id": "bean-255", "name": "萨尔瓦多优质豆", "origin": "萨尔瓦多", "variety": "阿拉比卡", "process": "水洗", "roast_level": "中烘", "flavor_tags": ["甜感", "坚果", "干净"], "purchase_price": 44, "usable_drinks": ["drink-pourover", "drink-espresso"], "source_chapter": "加工·酝酿发酵", "source_quote": "这些产地的人力成本通常更 低， 所以能够以较低的代价生产出优质咖啡。 目前萨尔瓦多咖啡就是 其中的代表。", "source_book": "咖啡全书", "confidence": "high" },
  { "id": "bean-256", "name": "苏门答腊湿刨豆", "origin": "印度尼西亚·苏门答腊", "variety": "阿拉比卡", "process": "湿刨", "roast_level": "中深烘", "flavor_tags": ["土壤", "草本", "醇厚"], "purchase_price": 54, "usable_drinks": ["drink-espresso", "drink-pourover"], "source_chapter": "加工·酝酿发酵", "source_quote": "另外还存在其他种类的发酵法， 如厌氧发酵和印度尼西亚苏门答 腊的湿刨法。在后一种方法中， 咖啡在发酵槽中发酵， 并在50%的湿 度下去除羊皮纸。", "source_book": "咖啡全书", "confidence": "high" },
  { "id": "bean-257", "name": "印尼二次晾晒豆", "origin": "印度尼西亚", "variety": "阿拉比卡", "process": "日晒", "roast_level": "中深烘", "flavor_tags": ["发酵感", "饱满", "强劲"], "purchase_price": 48, "usable_drinks": ["drink-espresso"], "source_chapter": "加工·酝酿发酵", "source_quote": "两次晾晒的 结果就如同充满了发酵缺陷的大杂烩， 凭借其饱满的口感和强劲的香 气赢得了某些消费者的青睐。", "source_book": "咖啡全书", "confidence": "high" },
  { "id": "bean-258", "name": "印度室内晾晒水洗豆", "origin": "印度", "variety": "阿拉比卡", "process": "水洗", "roast_level": "中烘", "flavor_tags": ["甘甜", "低酸", "缺陷感"], "purchase_price": 38, "usable_drinks": ["drink-espresso", "drink-latte"], "source_chapter": "加工·酝酿发酵", "source_quote": "在室内的湿度中晾晒的印度咖啡也是如 此——这种方法可以获得水洗咖啡， 口感甘甜， 但缺点也不少， 让人 又爱又恨", "source_book": "咖啡全书", "confidence": "high" },
  { "id": "bean-259", "name": "巴拿马蜜处理豆", "origin": "巴拿马·博克特", "variety": "阿拉比卡", "process": "蜜处理", "roast_level": "中浅烘", "flavor_tags": ["蜜香", "花香", "甜香", "酸香"], "purchase_price": 95, "usable_drinks": ["drink-pourover"], "source_chapter": "加工·酝酿发酵", "source_quote": "是通过改变黏膜、湿度、晾晒的方式 和时间来捍卫干式处理法 ，从而创造出新颖的发酵过程乃至香气特 点，比如蜜香、花香、甜香以及酸香。", "source_book": "咖啡全书", "confidence": "high" },
  { "id": "bean-260", "name": "哥伦比亚袋中发酵豆", "origin": "哥伦比亚", "variety": "阿拉比卡", "process": "厌氧发酵", "roast_level": "中浅烘", "flavor_tags": ["酒香", "果香", "发酵感"], "purchase_price": 68, "usable_drinks": ["drink-pourover"], "source_chapter": "加工·酝酿发酵", "source_quote": "在哥伦比亚， 人们 把整颗咖啡果装进25千克的袋子里存放8~48小时， 以形成“发红” （英 文为“foxy”） 的咖啡果", "source_book": "咖啡全书", "confidence": "medium" },
  { "id": "bean-261", "name": "卢旺达二次发酵水洗豆", "origin": "卢旺达", "variety": "波旁", "process": "水洗", "roast_level": "中浅烘", "flavor_tags": ["干净", "明亮", "甜感"], "purchase_price": 80, "usable_drinks": ["drink-pourover", "drink-espresso"], "source_chapter": "加工·酝酿发酵", "source_quote": "经过总共36小时的发酵 ，咖啡果被去除了所有黏膜 ，变得完全光秃秃 的，用手指碾压会嘎吱作响。", "source_book": "咖啡全书", "confidence": "high" },
  { "id": "bean-262", "name": "圣多美大果咖啡", "origin": "圣多美和普林西比", "variety": "大果咖啡", "process": "未标注", "roast_level": "中深烘", "flavor_tags": ["粗犷", "木质", "厚重"], "purchase_price": 30, "usable_drinks": ["drink-espresso"], "source_chapter": "种植·好苗苗长成咖啡树", "source_quote": "按照产量从大到小 ，分别是阿拉比卡、大果咖啡和罗 布斯塔 ，我最近还种植了高产咖啡。", "source_book": "咖啡全书", "confidence": "high" },
  { "id": "bean-263", "name": "印尼猫屎咖啡", "origin": "印度尼西亚", "variety": "阿拉比卡（预消化）", "process": "未标注", "roast_level": "中烘", "flavor_tags": ["饱满", "异国风味"], "purchase_price": 160, "usable_drinks": ["drink-pourover"], "source_chapter": "加工·酝酿发酵", "source_quote": "预消化咖啡豆凭借其饱满的口感和异 国风味而大受欢迎。 印度尼西亚的猫屎咖啡也是媒体报道最多的， 却很少有野生的。", "source_book": "咖啡全书", "confidence": "high" },
  { "id": "bean-264", "name": "阿拉库生物动力豆", "origin": "印度·阿拉库", "variety": "阿拉比卡", "process": "水洗", "roast_level": "中浅烘", "flavor_tags": ["甜感", "干净", "香料"], "purchase_price": 85, "usable_drinks": ["drink-pourover", "drink-latte"], "source_chapter": "捍卫·我们的信念", "source_quote": "我们现在正在进行一项了不起的事业——打造Araku品 牌，关注品质、社会平等和生物动力农法。", "source_book": "咖啡全书", "confidence": "high" }
]
