[
  {
    "id": "bean-001",
    "name": "示例豆·街角常备",
    "origin": "示例产地，待替换",
    "variety": "示例品种，待替换",
    "process": "水洗",
    "roast_level": "中烘",
    "flavor_tags": ["坚果", "焦糖"],
    "purchase_price": 30,
    "usable_drinks": ["drink-espresso", "drink-latte", "drink-pourover"],
    "source_chapter": "示例内容，待替换",
    "source_quote": "示例内容，待替换",
    "source_book": "示例内容，待替换",
    "confidence": "placeholder"
  },
  {
    "id": "bean-002",
    "name": "示例豆·浅烘花香",
    "origin": "示例产地，待替换",
    "variety": "示例品种，待替换",
    "process": "水洗",
    "roast_level": "浅烘",
    "flavor_tags": ["花香", "柑橘", "茶感"],
    "purchase_price": 48,
    "usable_drinks": ["drink-pourover"],
    "source_chapter": "示例内容，待替换",
    "source_quote": "示例内容，待替换",
    "source_book": "示例内容，待替换",
    "confidence": "placeholder"
  },
  {
    "id": "bean-003",
    "name": "示例豆·日晒果香",
    "origin": "示例产地，待替换",
    "variety": "示例品种，待替换",
    "process": "日晒",
    "roast_level": "中浅烘",
    "flavor_tags": ["浆果", "发酵感"],
    "purchase_price": 42,
    "usable_drinks": ["drink-pourover", "drink-espresso"],
    "source_chapter": "示例内容，待替换",
    "source_quote": "示例内容，待替换",
    "source_book": "示例内容，待替换",
    "confidence": "placeholder"
  },
  {
    "id": "bean-004",
    "name": "示例豆·深烘厚实",
    "origin": "示例产地，待替换",
    "variety": "示例品种，待替换",
    "process": "水洗",
    "roast_level": "深烘",
    "flavor_tags": ["可可", "烘烤感"],
    "purchase_price": 26,
    "usable_drinks": ["drink-espresso", "drink-latte"],
    "source_chapter": "示例内容，待替换",
    "source_quote": "示例内容，待替换",
    "source_book": "示例内容，待替换",
    "confidence": "placeholder"
  },
  {
    "id": "bean-005",
    "name": "示例豆·蜜处理甜感",
    "origin": "示例产地，待替换",
    "variety": "示例品种，待替换",
    "process": "蜜处理",
    "roast_level": "中浅烘",
    "flavor_tags": ["蜂蜜", "红糖", "柔和酸"],
    "purchase_price": 45,
    "usable_drinks": ["drink-pourover", "drink-latte"],
    "source_chapter": "示例内容，待替换",
    "source_quote": "示例内容，待替换",
    "source_book": "示例内容，待替换",
    "confidence": "placeholder"
  }
]
